{
  "case_id": "CASE-SYNTH-004",
  "member_id": "MEM-SYNTH-55672",
  "patient_age_years": 28,
  "patient_gender": "MALE",
  "clinical_domain": "advanced_imaging",
  "procedure_code": "74177",
  "procedure_name": "CT Abdomen and Pelvis / CT Enterography",
  "modality": "CT",
  "place_of_service": "OUTPATIENT_HOSPITAL",
  "primary_diagnosis_code": "K50.90",
  "diagnosis_description": "Crohn's disease, unspecified, without complications",
  "payer_id": "EVOLENT",
  "plan_id": "COMMERCIAL_HMO",
  "line_of_business": "COMMERCIAL",
  "jurisdiction": "US_NATIONAL",
  "request_date": "2026-05-12",
  "requested_date_of_service": "2026-05-15",
  "clinical_evidence": {
    "requested_modality": "CT",
    "patient_age_years": 28,
    "ordering_provider_license": true
  },
  "supporting_documentation_provided": [
    "GASTROENTEROLOGY_CLINICAL_NOTE"
  ],
  "ordering_provider": {
    "provider_specialty": "Gastroenterology",
    "is_licensed": true,
    "npi_synthetic": "1554433221"
  },
  "notes": "Synthetic test case: Patient under 35 with Crohn's requesting CT enterography. Triggers RULE-ADV-CG2000-003 flagged NEEDS_HUMAN_REVIEW for MR enterography advisory preference."
}
